{
  "sourceSystem": "calendar-production",
  "id": "webhook-calendar-019",
  "type": "event.updated",
  "occurredAt": "2026-08-28T12:05:00.000Z",
  "event": {
    "externalId": "calendar-event-9841",
    "sourceVersion": "event-revision-19",
    "title": "Summit Forward 2026",
    "startAt": "2026-09-18T10:00:00+06:00",
    "endAt": "2026-09-18T18:00:00+06:00",
    "timezone": "Asia/Dhaka",
    "location": { "label": "Grand Hall" },
    "attendanceTarget": 400,
    "organizer": {
      "displayName": "Summit Operations",
      "organization": "Forward Events",
      "role": "Event organizer"
    }
  }
}
